Hospital,Reviewer,Rating,Review
CNR MEDICARE,blob the fish,5 stars,"Excellent service, helpful staff. They were kind and patient with us and answered all our questions"
CNR MEDICARE,Elif Kıvrık,5 stars,"The team is professional, caring, and always ready to help. They make healthcare easy and stress-free. Highly recommend!"
CNR MEDICARE,Ece Susler,5 stars,I was pleased with the service they provided. nice service! Thank you
CNR MEDICARE,Remziye Süsler,5 stars,They are very good in the field of health tourism . We communicated quickly and received nurse and doctor service. thanks
CNR MEDICARE,Erdem Cengiz,5 stars,"Everything was perfect, they took care of me wonderfully."
CNR MEDICARE,ilknur yılmaz,5 stars,"Thank you for your health support, would recommend!"
CNR MEDICARE,Sema Nur Koç,5 stars,beautiful place and staff …
CNR MEDICARE,Rabia Okyar,5 stars,Amazing product …
CNR MEDICARE,Sıla Kurt,5 stars,Sıla Kurt 5 reviews       4 months ago
